{"case_id":"project-crashing-deadline","evaluated_at":"2026-09-02T00:00:00.000000Z","event_count":6,"final_event_hash":"d69c0d6db1ba06ba126a41a6c3d7b7f56a4dcdc92a102a63073441ec79d85136","harness_version":"0.1.0","input_hashes":{"inputs/case.json":"3229b104891fbc05d2e62afa75e51a0a9646958d1c1bd59a948af9330c7e2464"},"output_hashes":{"audit.json":"2d9585962ee7250f10fd40b95593d0609eeb955edf2530dd2ae2c38f98272761","decision.json":"8a323e9b5f980506ce9aae254db2fd2b0071d307c0d342ee6ca24d4741b7ed14","events.jsonl":"d8a97a804ab987cf71259f0a29f5bf487db2c32531fe0f16934137725e4ea89b","report.html":"e65f8b7b7e0a9770f3d63b0e83618ed823087cd5fef3558530e980059ecb0193","report.md":"368613360d02a572b85467859aee0109e21579a8372d51bc36294d12b90380a1","sensitivity.json":"5a4b11f07a50c0a82f9c48effc618f096eb1d0e810cedfa9e1fd9e164d3e282e","solution.json":"2f5e47c35ee67abc751fa29d8c1e278bc60d8db7103a3ddaa3017613b7b80a10","summary.json":"5f157825d20618bd27ddcd02da37cdd2ed1a1582569c80491e7538a95269026c"},"run_id":"0ba9385667c586b722cc36f5","schema_version":"1.0"}
