{"case_id":"technician-task-assignment","evaluated_at":"2026-09-02T00:00:00.000000Z","event_count":6,"final_event_hash":"3e308aea866090d436363c395910dd902c6b462f44f111cd85db08cb5460518b","harness_version":"0.1.0","input_hashes":{"inputs/case.json":"a0d68be9df6a8c6cac2dc9384fb9ac8a025f424b9ee8ea89a701d7ce161fcbeb"},"output_hashes":{"audit.json":"ee4a380bc49a7b159bfc85a399fe052bd6ba663e3072408e1dffa0b0a36f29f3","decision.json":"7c28a34d3ddef22b43029037c86680717cb5719223b8ca14d622eb361e654d6f","events.jsonl":"0eb647fd9ba2f43a278d4bdf2a62d05560d344d322136c35b43fef0b2085f993","report.html":"1b4f2924bb55bee188adc19f2f92de5e1e1f415ca567bb9faaa87ac387f2664f","report.md":"cd62f3e62bb1a1ca937bfb7f9329c1df1623a458c455511b43b8bf70fc9d659d","sensitivity.json":"f02054d9e94e5bdadc7473fee8abe81afadfe208807eced3c643e1cd38c8dba3","solution.json":"6d209858b8cf0abdb9aa40b1402602d359cd941532ec587eea90c149f00423cb","summary.json":"4553b229c10950c0817a2335758c952633d59594d7ccb3e4277cc433817bf808"},"run_id":"aa71d8a4ae4952b8b35eaea5","schema_version":"1.0"}
