{"case_id":"two-vehicle-routing","evaluated_at":"2026-09-02T00:00:00.000000Z","event_count":6,"final_event_hash":"560ef28b7c685485218848eead7163d094cef1d29c6b77054cfac9249b746bda","harness_version":"0.1.0","input_hashes":{"inputs/case.json":"833d7c0cf6de3abd9fad02c999d60324eba5d72f916447a050731a74231c6358"},"output_hashes":{"audit.json":"1899931b8163e2f9fb4c43e23e13ddd426d300d45ef066433e1224e6ba802652","decision.json":"044d812815a0fdae17a00d0c62cfecc9a1d0ccf18cbfaeaefcf9bf7961b7bf36","events.jsonl":"6053c7f35519564b3220733fc84081a223cd13e163ad9ff3f828636fbd20809a","report.html":"19e93ecc72d56f1fd7bb578ff667364a76c5b94d3f1c8dd2d3b16fccb9f55d83","report.md":"bf1684a7d36c6775e9dbd60fe3421cabc419a8791ef717eada7f55b30b677c12","sensitivity.json":"0d4c2a99b38d1db86e807ff7e8970f5b679410da089846ea4e796113e3afc973","solution.json":"0e9e8b7279902aa526fa0757cdc9f45c7b9779d624a5b48fed3b0819e3330498","summary.json":"71bdeb93f836f100618b99dbb3c451fa7c86a8b8f4b792912526dc204a8ee456"},"run_id":"95ebc8ed2c7fc8fe87f320b6","schema_version":"1.0"}
