{"case_id":"product-mix-capacity-allocation","evaluated_at":"2026-09-02T00:00:00.000000Z","event_count":6,"final_event_hash":"3f690c197d66a12e6a1fa28356b2d18dd3cca5a1dc8df820185ee26857cf9ed0","harness_version":"0.1.0","input_hashes":{"inputs/case.json":"b432d0d88f93358cb859987b054c2cd2a34d93513aea8dd5c5409e3b57597fbb"},"output_hashes":{"audit.json":"fa5787b323442bbbb38e47ab4b9d07e0c9be76a1b66a78589f6a8f191b0ace12","decision.json":"659d429e7532d037a430ab50de086ffeb25f32a25e354fdc7833ee16042f59eb","events.jsonl":"ea9819cc068f67db6c8600e8a6ccc57b7a27f8f6007c525cbe825f1271c5293f","report.html":"69bf51a21ba72b385cd46471ae9710dfc41bd63ef24c2568d9c9f784fcc77b63","report.md":"b15427c43b0434755dbc5d1ebb58fbcc8df5c703f188e5e4311bb8d5b77fcc7b","sensitivity.json":"94018884df4be1a93fa9ab8076a6b71a2752c8a9aea4a7032bc2d594c6013d35","solution.json":"56eec5532631272fa16cf11c187646e5ece0b74e6bda6efeaa9c692567e5be0c","summary.json":"d3e1d94c8e29c763a1e7d6f459271841a16b03e4c8b96e65cb7ae5979397b077"},"run_id":"21d035fc1cd33db6894dfdd0","schema_version":"1.0"}
