{"case_id":"capital-budget-portfolio","evaluated_at":"2026-09-02T00:00:00.000000Z","event_count":6,"final_event_hash":"38fdb3712441994629fa5a921d8b43c4dee98831cb04ca5e78e6f063cdf1a74f","harness_version":"0.1.0","input_hashes":{"inputs/case.json":"2a7222165f905d578a1f3cc60b6ed87d226a50e861a6ee5e820d9147c2dcd8e2"},"output_hashes":{"audit.json":"48c4c1b989663c6553fa7714f393e618505b287ae167909b2350f888ebe23fd2","decision.json":"9128a5641ab79a92e7755471a4f9f910a88b8a121a841e042c114283119f5889","events.jsonl":"7eaa9e3e0e3e58b0222c5421f89e953ffa7d1e0227096da00a126d6d423c6b5d","report.html":"40ca02d7d0deb627478b79fe44eb11065cef6018a95934e615bf6845b27f1a0c","report.md":"2a269346bc8c21eb5d4595f7cd1cbbdf68c7eadeb1fc528435d38ec8da1ee1fe","sensitivity.json":"9fed9bde2c14e0dfa092b24e7cf621bcdc95f26e29049c580ff8c0163620c2ab","solution.json":"7f2838b204198c5f07fae6fe2689b11b5a17e1bccacb23f69d66eca656b6399a","summary.json":"70382bfd5d229954b5bfd1ed96ddc5b895bd999e102dd7acbd08e842f1846109"},"run_id":"56596312cc45e085dc1ed068","schema_version":"1.0"}
