{"case_id":"seasonal-newsvendor-order","evaluated_at":"2026-09-02T00:00:00.000000Z","event_count":6,"final_event_hash":"a0e5e8c256f7d257cab9a5b329652cd640ea43f0cecec2d143ac9a4d8e665fbe","harness_version":"0.1.0","input_hashes":{"inputs/case.json":"efd3a82e3d1bd2c31e0a3539493677e4746332589550e0086e8a45754093ff17"},"output_hashes":{"audit.json":"a002da1db49baddc7622c6c49374964b292f3b35bf62bb5a07780b340abd51bd","decision.json":"a8bdff1f33f10c26e9dc201405925164925a99276c93f50b5fb6271c954ae86d","events.jsonl":"be9b8abdb53fa38a7028e49c07d763622e73de19f7d1ce9f81e530979b9b516a","report.html":"19c43a3b26a97ac523b7cf27c374aefcc6ec5f99f721b2deeee1bab34deb7945","report.md":"c54c55c7299cd60c7873529c73fc77b2290755c69fc7ffc4ce9e4b8506dbde71","sensitivity.json":"f7ec54c92db27b6210510cb17a3d59f4ec63683dc5cc4936e69607f28af42bf1","solution.json":"7e12d968979fe0266cd3e9f84a0319e04901ecce88fa511c10f442d578cea08e","summary.json":"aeb6a5cc775d15c4f8efc8440274531e0aa13197bf4ee68a47ff2dd949d79b8e"},"run_id":"1fdf72e13b1eed640c2f5631","schema_version":"1.0"}
