{"case_id":"weekly-workforce-coverage","evaluated_at":"2026-09-02T00:00:00.000000Z","event_count":6,"final_event_hash":"fd4c4212c2ff41626b6fc23c72d5dc9f75736cd1c6edbb7e4957e188de7fed15","harness_version":"0.1.0","input_hashes":{"inputs/case.json":"425bc9ded08039710b49a1c179910cdedd5e38533dd8dca11247f966563a7fc0"},"output_hashes":{"audit.json":"2c07e72a61e7e00b31956feb3826074525687fbd656d1d4dad7a3b3689fa69b8","decision.json":"4a4517c0981fbc65cafce2855abb82d9b8cd159919b4e3d12a7f37513d41dd27","events.jsonl":"c5adc1dfdc3ff5914f679db494669c0c085444a5d175b80145e57eaf5377eb5a","report.html":"b578162ef0d7ddd0b5eecddf1811d18c309f40b080f611572eb969d8af91e728","report.md":"f902f4a7935b715f4fcf27bc589501339d42f6fb42cfc6064e029798d6ec498b","sensitivity.json":"7fbeb86ec36ca9b0a435d1bad00fa7324ead780fc3b4bc1f774023ffe86f535f","solution.json":"d52d6387096cd1eb373558cab8e37d302704fd70e961089ccb35d1da5ebb712e","summary.json":"ea37e3e1d92abf9b8a98bfcbb28ce14ae3dcc3681ced917a288671684e270b0a"},"run_id":"600cec0bb9b4799164d7569a","schema_version":"1.0"}
