{"case_id":"robust-capacity-choice","evaluated_at":"2026-09-02T00:00:00.000000Z","event_count":6,"final_event_hash":"62e8331af92cfe46456ff7b62f0558c9e26e1710ab7a9a2ac6031f51eec7a3ad","harness_version":"0.1.0","input_hashes":{"inputs/case.json":"788967dec6e3ec5053a274c9a2a9424cd671fbfdb01e7da1d660b8f7d16e1e88"},"output_hashes":{"audit.json":"0ed82e6b749afba9d642cd66ec7e7c4bdc51af93956fdf3a32e0fb410d63285f","decision.json":"822e415ef6af5b7106a1780181dcab00aa1cde7d52f3e7a6630e6cb339baa032","events.jsonl":"a6470828989e8069b3d614836008167bc5ad8ae6c4c3a5c89e0c2546e6b86403","report.html":"c674af2b5be4159011eabd42b23f3cb4cce6bbe1838d732cdb31ecaba447646b","report.md":"32c7b1404d79b8f160687cffee5e367027269b8073a3392dcb59f2c3992d1ce0","sensitivity.json":"baacd3dc8f790f1307d5b06058f771f349033e34fc71ebe7c505b59740568b3f","solution.json":"fd88e46f2e7b1444c1e733aa983055f3e980e2645ae31b7c6e23891a0b6318ad","summary.json":"dbe15bf04e51102d3030706019dbee50fc4d181b040700419512357196d3d2dd"},"run_id":"8191b67500959bb18e02e828","schema_version":"1.0"}
