{"case_id":"regional-facility-location","evaluated_at":"2026-09-02T00:00:00.000000Z","event_count":6,"final_event_hash":"66f2543ab06ee82b6d74c499472d7165d1ce4fa07dc0d4d38595c4869519d2ec","harness_version":"0.1.0","input_hashes":{"inputs/case.json":"bb608979f58a64e43395b5737d1df3c54f1f9a23f4bf554d2e1839ce17b9753a"},"output_hashes":{"audit.json":"ee016e1cfee4095e843a07893ff16383a8862d87f1ec4da2171b42297af7abec","decision.json":"00728c5e6705d85d912360ae518ac46cb6560f2bf76348f8857fd383b21df591","events.jsonl":"48a1a23b5b67f0656223b2ec189b93cbcf1bf6bc20471ec0da19a7fff79738ed","report.html":"52fb16156f5af0a5a3827eb4a500c8e951e03ff022ffd7ec501588093344a88f","report.md":"0fafb568d9780ee238ea4e866166c055c51b79d381ade25da58bd15643d3e933","sensitivity.json":"4dedb1a26250e88c386d283bc94b01b9b3780e1be88918689e42d9356a363f51","solution.json":"92685fd86884e7e8527ce949f72fbb8568068a19e694907ce24f87fe427b5503","summary.json":"660cbb5631c429149376529781cfd0b9787712fb48547642f8ae89d7e6cb052e"},"run_id":"b7b499bac4ae692e8f878c51","schema_version":"1.0"}
