{"case_id":"transportation-network-allocation","evaluated_at":"2026-09-02T00:00:00.000000Z","event_count":6,"final_event_hash":"38ff784d8164a66744c6c3ba9e14bfe29b140e771ded4b67f1570652e917b543","harness_version":"0.1.0","input_hashes":{"inputs/case.json":"7e49845bc74a2c1a7984f0a2ccb0188d611bc28812580e68c81e9cb987217dd5"},"output_hashes":{"audit.json":"38675cc54dc2b1379849d3b0a06c461362d115354a9c9dc60b801826e4234987","decision.json":"f2ffe23495dc6f7e8710f618cb0777381094e086f54414311adc9ec62fd92287","events.jsonl":"c3ba09e54a8328bd5c5553ba418127d78f15820fb09ea75ad23b41d9ac306b4a","report.html":"1df09a1b81061191fb893fe83bed69ef492d583a1b5cb2133d16f0ea336bab7c","report.md":"c4efdf1f4af383929453af8ecd61da90857017b72c41903bdacaaaead98eee68","sensitivity.json":"6e1ee6b9b5058f8ff8215140410a041328a82cdd4132394f4500eb843eacd93a","solution.json":"33e4d5bf1a4b6706c8371f8b651d3adaf900182085362ee3fb771eb353f27a42","summary.json":"982d7751312b7d3f480c0cbb31d5552ac838c1ef10815dc6c0c63a9b7f8d88fa"},"run_id":"c3887c9abebfaaa9bd1b7808","schema_version":"1.0"}
